Question,Answer
"Регистрация права собственности на квартиру (дом, нежилое помещение) в МФЦ доступна следующим категориям заявителей: которые являются владельцами объекта недвижимости (доли в общей собственности), Примечание: несовершеннолетний, имеющий паспорт гражданина РФ (возрастом от 14 до 18 лет), вправе подать документы в МФЦ самостоятельно, без согласия родителей, попечителей, опекунов. В случае если право возникает на основании нотариально удостоверенной сделки, заявление о государственной регистрации может быть представлено нотариусом (работником нотариуса). Обратите внимание: оформить право собственности на квартиру в новостройке (в том числе приобретенную по ипотеке) возможно только после постановки застройщиком объекта на кадастровый учет. Если обязанность по оформлению кадастрового учета, в соответствии с условиями сделки, возлагается на покупателя жилого помещения (если признание прав участника долевого строительства производится в судебном порядке в связи с банкротством застройщика), то постановка на кадастровый учет осуществляется одновременно с регистрацией права собственности на данный объект. Государственная услуга оказывается по экстерриториальному принципу – адрес заявителя и место нахождения объекта недвижимости на территории РФ значения не имеет. Многофункциональные центры принимают заявителей по предварительной записи или в порядке «живой» электронной очереди. Записаться на прием заранее можно: Государственная регистрация прав на объект недвижимости облагается пошлиной в соответствии с подп. 22 п. 1 ст. 333.33 НК РФ: Примечание: за регистрацию квартиры, полученной по наследству или купленной в ипотеку, пошлина взимается в том же размере. Если жилье было приобретено в долевую собственность на основании договора купли-продажи (мены, дарения, ренты и пр.), пошлину уплачивает каждый из собственников пропорционально размеру своей доли (например: 4 граждан являются владельцами одного объекта, доля каждого из них составляет ¼, нужно заплатить по 500 руб. отдельными квитанциями). Обратите внимание: если при подаче документов на оформление объекта недвижимости в долевую собственность присутствуют не все владельцы долей (например: за 3 гражданами признано право владения квартирой в судебном порядке, доли этих лиц составляют: ½, ¼, ¼; в МФЦ одновременно явились только 2 их них, имеющих доли ½ и ¼), то пошлина уплачивается пропорционально количеству обратившихся лиц (в нашем примере каждый из 2 собственников должен заплатить по 1000 руб. независимо от размера его доли). В случаях, когда оформление долевой собственности не связано с регистрацией прав на объект недвижимости (например: наследование, полная выплата паевого взноса членом ЖСК), пошлина уплачивается каждым владельцем доли в полном объеме. Произвести оплату можно через терминал, расположенный в помещении МФЦ. В МФЦ представляется: Бланк заявления можно скачать здесь: https://rosreestr.ru/site/fiz/zaregistrirovat-nedvizhimoe-imushchestvo-/blanki-obraztsy-zayavleniy-xml-skhemy8154/ Обратите внимание: Если сделка совершена в простой письменной форме, представляется не менее 2 экземпляров-подлинников договора, один из которых впоследствии возвращается правообладателю, а другой остается на хранении в реестровом деле. В случаях, когда сделка удостоверена нотариально, предоставляется не менее 2 экземпляров договора, один из которых оригинал. В зависимости от ситуации к правоустанавливающему документу должны быть приложены: Обратите внимание: перечень документов, являющихся основанием для оформления прав на недвижимое имущество, является открытым, поэтому перед посещением МФЦ рекомендуется позвонить по телефону горячей линии и уточнить, какая именно документация должна быть представлена в вашей ситуации. В случае обращения представителя заявителя дополнительно предъявляется: 1) Документ, удостоверяющий личность представителя. 2) Нотариальная доверенность (доверенность от организации), выданная владельцем недвижимости своему уполномоченному лицу. Копии паспорта гражданина РФ и прочих документов, которые должны быть возвращены заявителю после идентификации личности и сверки данных, работник МФЦ сделает самостоятельно непосредственно на приеме. По факту подачи запроса и необходимых документов сотрудник центра выдаст заявителю расписку, по номеру которой можно отслеживать статус обращения через местный сайт МФЦ или по телефону горячей линии (контактному телефону отделения, которое приняло заявление). Срок предоставления государственной услуги – 9 рабочих дней. В некоторых регионах Многофункциональные центры информируют заявителя о готовности документов через СМС-рассылку. По истечении установленного срока заявителю будет выдан на руки результат оказания услуги: Основание для отказа в приеме документов: Основания для приостановления оказания госуслуги: Полный перечень оснований для приостановления оказания услуги приведен в ст. 26 закона от 13.07.2015 № 218-ФЗ (ред. 03.04.2018). Отказ в регистрации прав на квартиру (дом, нежилое помещение): Вам отказали в оказании услуги, и Вы считаете, что отказ неправомерен? У Вас имеется другая сложная правовая ситуация или вопросы, требующие оказания юридической помощи (не обязательно связанные с МФЦ)? Позвоните и получите консультацию юриста БЕСПЛАТНО! Для жителей Москвы и МО - 84995770025 доб. 128 Санкт-Петербург и Лен. область - 88124256630 доб. 128 Имя * E-mail * Комментарий  Оповещать об ответе на мой комментарий по e-mail Оформление квартиры в собственность, Жилищные услуги","https://mfc-spravka.ru/oformlenie-kvartiry-v-sobstvennost-v-mfc.html[sep]Оформление квартиры в собственность, Жилищные услуги"
